{
  "schema_version": "0.1",
  "contract_status": "draft",
  "observation_id": "final_observation_001",
  "source_photo_id": "final_photo_001",
  "observations": [
    {
      "dimension": "subject_relation",
      "fact": "近处树枝遮挡了山脊左侧的一小段轮廓。",
      "evidence": "树枝深色边缘与山脊亮边在画面左上区域交叠。",
      "confidence": 0.96,
      "region": [0.08, 0.08, 0.34, 0.38]
    },
    {
      "dimension": "tone",
      "fact": "湖面中部亮区比山体与前景树枝更亮。",
      "evidence": "亮区形成从画面中部向远处山脊延伸的连续带状区域。",
      "confidence": 0.92
    },
    {
      "dimension": "visible_artifact",
      "fact": "湖面亮区边缘存在轻微色阶断层。",
      "evidence": "亮区右侧可见数条相邻、边界较硬的色带。",
      "confidence": 0.71,
      "uncertainty": "压缩预览可能放大了色阶断层，需要查看原尺寸文件确认。"
    }
  ],
  "uncertainties": [
    "当前输入是压缩预览，无法可靠判断原始文件中的细节锐度。"
  ],
  "created_at": "2026-07-24T08:10:00Z"
}
